{
  "schemaVersion": "1.0",
  "recipeId": "tbsb_neon_arena_production_v1",
  "cardId": "turn_based_skill_battle",
  "status": "production_recipe",
  "productionReady": true,
  "requireProductionCard": true,
  "modifiers": [],
  "knobs": {
    "playerHp": 100,
    "enemyHp": 120,
    "enemyAtk": 16,
    "playerAtk": 20,
    "allowQuit": true,
    "allowPause": true,
    "artRuntimeMode": "prototype"
  },
  "contentPackRef": "minigame_master/gameplay/cards/fixtures/turn_based_skill_battle/theme_content_pack.neon.json",
  "assetPackRef": {
    "workspaceId": "20260611-060754-719406",
    "imagegenManifest": "assets/imagegen/manifest.json",
    "imagegenAtlas": "assets/imagegen/atlas.png"
  },
  "audioPackRef": {
    "workspaceId": "20260611-060754-719406",
    "root": "assets/audio",
    "cues": {
      "bgm_main": "bgm/node1_battle.wav",
      "sfx_hit": "sfx/hit.wav",
      "sfx_win": "bgm/victory_sting.wav",
      "sfx_lose": "bgm/defeat_sting.wav"
    }
  },
  "balanceProfile": "normal_short",
  "locale": "zh-CN",
  "notes": [
    "Neon arena skin — content pack swap only."
  ]
}
