{
  "schemaVersion": "1.0",
  "recipeId": "energy_balance_default_production_v1",
  "cardId": "energy_balance",
  "status": "production_recipe",
  "productionReady": true,
  "requireProductionCard": true,
  "modifiers": [],
  "knobs": {
    "targetStableSec": 12,
    "failOverWarn": 8,
    "failViolationLimit": 8,
    "orbSpawnMinSec": 1,
    "orbSpawnMaxSec": 1.8,
    "allowQuit": true,
    "allowPause": true,
    "artRuntimeMode": "prototype"
  },
  "contentPackRef": "minigame_master/gameplay/cards/fixtures/energy_balance/theme_content_pack.fixture.json",
  "assetPackRef": {
    "workspaceId": "20260611-060754-719406",
    "imagegenManifest": "assets/imagegen/manifest.json",
    "imagegenAtlas": "assets/imagegen/atlas.png"
  },
  "audioPackRef": {
    "workspaceId": "20260611-060754-719406",
    "root": "assets/audio",
    "cues": {
      "bgm_main": "bgm/node1_battle.wav",
      "sfx_hit": "sfx/hit.wav",
      "sfx_win": "bgm/victory_sting.wav",
      "sfx_lose": "bgm/defeat_sting.wav"
    }
  },
  "balanceProfile": "normal_short",
  "locale": "zh-CN",
  "notes": [
    "Lightweight production recipe for energy_balance"
  ]
}
