{
  "schemaVersion": "1.0",
  "recipeId": "drag_to_core_default_production_v1",
  "cardId": "drag_to_core",
  "status": "production_recipe",
  "productionReady": true,
  "requireProductionCard": true,
  "modifiers": [],
  "knobs": {
    "fragCount": 8,
    "hazardCount": 2,
    "hazardSpeed": 70,
    "hazardPenalty": 10,
    "allowQuit": true,
    "allowPause": true,
    "artRuntimeMode": "prototype"
  },
  "contentPackRef": "minigame_master/gameplay/cards/fixtures/drag_to_core/theme_content_pack.fixture.json",
  "assetPackRef": {
    "workspaceId": "20260611-060754-719406",
    "imagegenManifest": "assets/imagegen/manifest.json",
    "imagegenAtlas": "assets/imagegen/atlas.png"
  },
  "audioPackRef": {
    "workspaceId": "20260611-060754-719406",
    "root": "assets/audio",
    "cues": {
      "bgm_main": "bgm/node1_battle.wav",
      "sfx_hit": "sfx/hit.wav",
      "sfx_win": "bgm/victory_sting.wav",
      "sfx_lose": "bgm/defeat_sting.wav"
    }
  },
  "balanceProfile": "normal_short",
  "locale": "zh-CN",
  "notes": [
    "Lightweight production recipe for drag_to_core"
  ]
}
