{
  "schemaVersion": "1.0",
  "recipeId": "drag_collect_void_production_v1",
  "cardId": "drag_collect_grid",
  "status": "production_recipe",
  "productionReady": true,
  "requireProductionCard": true,
  "modifiers": [],
  "knobs": {
    "timeLimitSec": 40,
    "durationSec": 40,
    "needAmount": 12,
    "goalValue": 12,
    "spawnIntervalMs": 550,
    "itemSpeed": 260,
    "hazardRate": 0.28,
    "damageOnHit": 14,
    "difficulty": 1,
    "skipBoss": true,
    "artRuntimeMode": "prototype",
    "allowQuit": true,
    "allowPause": true
  },
  "contentPackRef": "minigame_master/gameplay/cards/fixtures/drag_collect_grid/theme_content_pack.fixture.json",
  "assetPackRef": {
    "workspaceId": "20260611-060754-719406",
    "imagegenManifest": "assets/imagegen/manifest.json",
    "imagegenAtlas": "assets/imagegen/atlas.png"
  },
  "audioPackRef": {
    "workspaceId": "20260611-060754-719406",
    "root": "assets/audio",
    "cues": {
      "bgm_main": "bgm/node1_battle.wav",
      "sfx_hit": "sfx/hit.wav",
      "sfx_win": "bgm/victory_sting.wav",
      "sfx_lose": "bgm/defeat_sting.wav"
    }
  },
  "balanceProfile": "normal_short",
  "locale": "zh-CN",
  "notes": [
    "Production recipe for drag_collect_grid (skipBoss pure collect loop)."
  ]
}
