{
  "schemaVersion": "1.0",
  "recipeId": "survivor_horde_golden_demo_v1",
  "cardId": "survivor_horde",
  "status": "prototype_recipe",
  "productionReady": false,
  "modifiers": [],
  "knobs": {
    "durationSec": 45,
    "enemySpawnRateSec": 1.2,
    "artRuntimeMode": "prototype",
    "goalValue": 100
  },
  "contentPackRef": "minigame_master/gameplay/cards/fixtures/survivor_horde/theme_content_pack.fixture.json",
  "assetPackRef": {
    "workspaceId": "20260611-060754-719406",
    "imagegenManifest": "assets/imagegen/manifest.json",
    "imagegenAtlas": "assets/imagegen/atlas.png",
    "goldenFixture": "minigame_master/gameplay/cards/fixtures/survivor_horde/golden_asset_fixture.json"
  },
  "audioPackRef": {
    "workspaceId": "20260611-060754-719406",
    "root": "assets/audio",
    "cues": {
      "bgm_main": "bgm/node1_battle.wav",
      "sfx_hit": "sfx/hit.wav",
      "sfx_win": "bgm/victory_sting.wav",
      "sfx_lose": "bgm/defeat_sting.wav"
    }
  },
  "balanceProfile": "normal_short",
  "notes": [
    "Recipe draft for theme+asset skinning vertical slice.",
    "Not production_ready: awaits Playwright E2E, visual, soak, human sign-off."
  ]
}
