{
  "schemaVersion": "1.0",
  "recipeId": "rhythm_timing_temple_production_v1",
  "cardId": "rhythm_timing",
  "status": "production_recipe",
  "productionReady": true,
  "requireProductionCard": true,
  "modifiers": [],
  "knobs": {
    "durationSec": 45,
    "goalValue": 15,
    "difficulty": 1,
    "beatIntervalMs": 900,
    "spawnIntervalMs": 900,
    "orbLifetimeMs": 1800,
    "targetProgress": 15,
    "skipBoss": true,
    "artRuntimeMode": "prototype",
    "allowQuit": true,
    "allowPause": true
  },
  "contentPackRef": "minigame_master/gameplay/cards/fixtures/rhythm_timing/theme_content_pack.fixture.json",
  "assetPackRef": {
    "workspaceId": "20260611-060754-719406",
    "imagegenManifest": "assets/imagegen/manifest.json",
    "imagegenAtlas": "assets/imagegen/atlas.png"
  },
  "audioPackRef": {
    "workspaceId": "20260611-060754-719406",
    "root": "assets/audio",
    "cues": {
      "bgm_main": "bgm/node1_battle.wav",
      "sfx_hit": "sfx/hit.wav",
      "sfx_win": "bgm/victory_sting.wav",
      "sfx_lose": "bgm/defeat_sting.wav"
    }
  },
  "balanceProfile": "normal_short",
  "locale": "zh-CN",
  "notes": [
    "Production recipe for rhythm_timing after production_ready certification.",
    "skipBoss keeps pure timing loop; boss phase remains optional residual."
  ]
}
