{
  "schemaVersion": "1.0",
  "recipeId": "reaction_pick_neon_production_v1",
  "cardId": "reaction_pick",
  "status": "production_recipe",
  "productionReady": true,
  "requireProductionCard": true,
  "modifiers": [],
  "knobs": {
    "targetRounds": 4,
    "lives": 5,
    "showLifeMinSec": 2.2,
    "showLifeMaxSec": 3.2,
    "allowQuit": true,
    "allowPause": true,
    "artRuntimeMode": "prototype"
  },
  "contentPackRef": "minigame_master/gameplay/cards/fixtures/reaction_pick/theme_content_pack.neon.json",
  "assetPackRef": {
    "workspaceId": "20260611-060754-719406",
    "imagegenManifest": "assets/imagegen/manifest.json",
    "imagegenAtlas": "assets/imagegen/atlas.png"
  },
  "audioPackRef": {
    "workspaceId": "20260611-060754-719406",
    "root": "assets/audio",
    "cues": {
      "bgm_main": "bgm/node1_battle.wav",
      "sfx_hit": "sfx/hit.wav",
      "sfx_win": "bgm/victory_sting.wav",
      "sfx_lose": "bgm/defeat_sting.wav"
    }
  },
  "balanceProfile": "normal_short",
  "locale": "zh-CN",
  "notes": [
    "Lightweight production recipe for reaction_pick"
  ]
}
